{
  "id": 11957,
  "name": "Extended antifire (1)",
  "tradeable": true,
  "stackable": false,
  "noteable": true,
  "equipable": false,
  "members": true,
  "weight": 0.0,
  "buy_limit": -1,
  "quest_item": true,
  "release_date": "27 March 2014",
  "cost": 110,
  "lowalch": 44,
  "highalch": 66,
  "examine": "X dose(s) of extended anti-firebreath potion.",
  "url": "http://2007.runescape.wikia.com/wiki/Extended_antifire"
}