{
  "id": 1997,
  "name": "Incomplete stew",
  "tradeable": false,
  "stackable": false,
  "noteable": true,
  "equipable": false,
  "members": false,
  "weight": 1.0,
  "buy_limit": -1,
  "quest_item": true,
  "release_date": "11 June 2001",
  "cost": 4,
  "lowalch": 1,
  "highalch": 2,
  "examine": "I need to add some meat too.",
  "url": "http://2007.runescape.wikia.com/wiki/Incomplete_stew"
}