{
  "id": 1839,
  "name": "Metal key",
  "tradeable": false,
  "stackable": false,
  "noteable": false,
  "equipable": false,
  "members": true,
  "weight": 0.0,
  "buy_limit": -1,
  "quest_item": true,
  "release_date": "14 April 2003",
  "cost": 1,
  "lowalch": 0,
  "highalch": 0,
  "examine": "This key is crudely made. It came from the mining camp Mercenary Captain (Provides access to the Desert Mining Camp).",
  "url": "http://2007.runescape.wikia.com/wiki/Metal_key"
}