{
  "id": 4429,
  "name": "Broken vane part",
  "tradeable": false,
  "stackable": false,
  "noteable": false,
  "equipable": false,
  "members": true,
  "weight": 0.0,
  "buy_limit": -1,
  "quest_item": true,
  "release_date": "28 February 2005",
  "cost": 1,
  "lowalch": 0,
  "highalch": 0,
  "examine": "This weather vane ornament is damaged.",
  "url": "http://2007.runescape.wikia.com/wiki/Broken_vane_part"
}