{
    "id": 949,
    "name": "Bear fur",
    "members": false,
    "tradeable": false,
    "stackable": true,
    "noted": true,
    "noteable": true,
    "equipable": false,
    "cost": 10,
    "lowalch": 4,
    "highalch": 6,
    "weight": 3.0,
    "buy_limit": null,
    "quest_item": null,
    "release_date": "04 January 2001",
    "examine": [
        "This would make warm clothing."
    ],
    "url": "http://oldschoolrunescape.wikia.com/wiki/Bear_fur"
}