{
  "id": 21473,
  "name": "Teak seedling (w)",
  "tradeable": false,
  "stackable": false,
  "noteable": false,
  "equipable": false,
  "members": true,
  "weight": 0.0,
  "buy_limit": -1,
  "quest_item": true,
  "release_date": "07 September 2017",
  "cost": 1,
  "lowalch": 0,
  "highalch": 0,
  "examine": "A teak tree seed has been sown and watered in this plant pot.",
  "url": "http://2007.runescape.wikia.com/wiki/Teak_seedling_(w)"
}