{
    "id": 5852,
    "name": "Dwarven stout(m1)",
    "members": true,
    "tradeable": false,
    "stackable": true,
    "noted": true,
    "noteable": true,
    "equipable": false,
    "cost": 1,
    "lowalch": 0,
    "highalch": 0,
    "weight": 0.0,
    "buy_limit": null,
    "quest_item": null,
    "release_date": "11 July 2005",
    "examine": "This keg contains 1 pint of mature Dwarven Stout.",
    "url": "https://oldschool.runescape.wiki/w/Dwarven_stout(m)_(keg)"
}