{
    "id": 1784,
    "name": "Bucket of sand",
    "members": true,
    "tradeable": false,
    "stackable": true,
    "noted": true,
    "noteable": true,
    "equipable": false,
    "cost": 2,
    "lowalch": 0,
    "highalch": 1,
    "weight": 2.0,
    "buy_limit": null,
    "quest_item": null,
    "release_date": "18 March 2002",
    "examine": [
        "One of the ingredients for making glass."
    ],
    "url": "https://oldschool.runescape.wiki/w/Bucket_of_sand"
}