{
    "id": 8446,
    "name": "Fancy hedge",
    "members": true,
    "tradeable": false,
    "stackable": true,
    "noted": true,
    "noteable": true,
    "equipable": false,
    "cost": 25000,
    "lowalch": 10000,
    "highalch": 15000,
    "weight": null,
    "buy_limit": null,
    "quest_item": null,
    "release_date": null,
    "examine": "Like a living wall.",
    "url": "https://oldschool.runescape.wiki/w/Fancy_hedge"
}