{
  "id": 1959,
  "name": "Pumpkin",
  "tradeable": true,
  "stackable": false,
  "noteable": true,
  "equipable": false,
  "members": false,
  "weight": 0.5,
  "buy_limit": -1,
  "quest_item": true,
  "release_date": "31 October 2001",
  "cost": 30,
  "lowalch": 12,
  "highalch": 18,
  "examine": "Happy Halloween.",
  "url": "http://2007.runescape.wikia.com/wiki/Pumpkin"
}