{
  "id": 4436,
  "name": "Airtight pot",
  "tradeable": true,
  "stackable": false,
  "noteable": true,
  "equipable": false,
  "members": true,
  "weight": 0.5,
  "buy_limit": -1,
  "quest_item": true,
  "release_date": "28 February 2005",
  "cost": 10,
  "lowalch": 4,
  "highalch": 6,
  "examine": "This is pretty well sealed.",
  "url": "http://2007.runescape.wikia.com/wiki/Airtight_pot"
}