{
  "id": 9662,
  "name": "Shortcut key",
  "tradeable": false,
  "stackable": false,
  "noteable": false,
  "equipable": false,
  "members": true,
  "weight": 0.055,
  "buy_limit": -1,
  "quest_item": true,
  "release_date": "04 September 2006",
  "cost": 1,
  "lowalch": 0,
  "highalch": 0,
  "examine": "A key allowing a shortcut into the Sanguinesti region (Quick access through Meiyerditch).",
  "url": "http://2007.runescape.wikia.com/wiki/Shortcut_key"
}