{
  "id": 11689,
  "name": "Earth rune",
  "tradeable": false,
  "stackable": true,
  "noteable": false,
  "equipable": false,
  "members": false,
  "weight": 0.0,
  "buy_limit": 20000,
  "quest_item": true,
  "release_date": "04 January 2001",
  "cost": 1,
  "lowalch": 0,
  "highalch": 0,
  "examine": "One of the 4 basic elemental Runes.",
  "url": "http://2007.runescape.wikia.com/wiki/Earth_rune"
}