{
  "id": 6289,
  "name": "Snakeskin",
  "tradeable": true,
  "stackable": false,
  "noteable": true,
  "equipable": false,
  "members": true,
  "weight": 0.5,
  "buy_limit": -1,
  "quest_item": true,
  "release_date": "09 August 2005",
  "cost": 50,
  "lowalch": 20,
  "highalch": 30,
  "examine": "Scaley but not slimy!",
  "url": "http://2007.runescape.wikia.com/wiki/Snakeskin"
}