{
  "id": 4589,
  "name": "Keys",
  "tradeable": false,
  "stackable": false,
  "noteable": false,
  "equipable": false,
  "members": true,
  "weight": 0.0,
  "buy_limit": -1,
  "quest_item": true,
  "release_date": "04 April 2005",
  "cost": 1,
  "lowalch": 0,
  "highalch": 0,
  "examine": "Keys to the Mayor's house.",
  "url": "http://2007.runescape.wikia.com/wiki/Keys"
}