{
  "id": 21217,
  "name": "Fresh easter egg",
  "tradeable": false,
  "stackable": false,
  "noteable": false,
  "equipable": false,
  "members": false,
  "weight": 0.0,
  "buy_limit": -1,
  "quest_item": true,
  "release_date": "06 April 2017",
  "cost": 1,
  "lowalch": 0,
  "highalch": 0,
  "examine": "A fresh flavoured Easter egg",
  "url": "http://2007.runescape.wikia.com/wiki/Fresh_easter_egg"
}