{
  "id": 9984,
  "name": "Skewered bird meat",
  "tradeable": false,
  "stackable": false,
  "noteable": true,
  "equipable": false,
  "members": true,
  "weight": 1.65,
  "buy_limit": -1,
  "quest_item": true,
  "release_date": "21 November 2006",
  "cost": 81,
  "lowalch": 32,
  "highalch": 48,
  "examine": "Skewered bird meat.",
  "url": "http://2007.runescape.wikia.com/wiki/Skewered_bird_meat"
}