{
    "id": 19426,
    "name": "Sanfew serum(3)",
    "members": false,
    "tradeable": true,
    "tradeable_on_ge": false,
    "stackable": false,
    "noted": false,
    "noteable": false,
    "linked_id": null,
    "equipable": false,
    "cost": 0,
    "lowalch": 0,
    "highalch": 0,
    "weight": 0.0,
    "buy_limit": 2000,
    "quest_item": null,
    "release_date": "13 March 2007",
    "examine": "3 doses of Sanfew Serum.",
    "url": "https://oldschool.runescape.wiki/w/Sanfew_serum"
}