{
    "id": 17989,
    "name": "Red toad",
    "members": false,
    "tradeable": false,
    "stackable": false,
    "noted": false,
    "noteable": false,
    "equipable": false,
    "cost": 0,
    "lowalch": 0,
    "highalch": 0,
    "weight": 0.0,
    "buy_limit": null,
    "quest_item": [
        "Mourning's Ends Part I"
    ],
    "release_date": "19 July 2005",
    "examine": [
        "A red dye filled toad."
    ],
    "url": "http://oldschoolrunescape.wikia.com/wiki/Red_toad"
}