{
    "id": 10817,
    "name": "Raw yak meat",
    "members": true,
    "tradeable": false,
    "stackable": true,
    "noted": true,
    "noteable": true,
    "equipable": false,
    "cost": 2,
    "lowalch": 0,
    "highalch": 1,
    "weight": 3.0,
    "buy_limit": null,
    "quest_item": null,
    "release_date": "06 February 2007",
    "examine": [
        "I need to cook this."
    ],
    "url": "http://oldschoolrunescape.wikia.com/wiki/Raw_yak_meat"
}