{
    "id": 21865,
    "name": "Fine mesh net",
    "members": false,
    "tradeable": false,
    "stackable": false,
    "noted": false,
    "noteable": false,
    "equipable": false,
    "cost": 1,
    "lowalch": 0,
    "highalch": 0,
    "weight": 0.0,
    "buy_limit": null,
    "quest_item": null,
    "release_date": "11 December 2017",
    "examine": [
        "Only the most delicious nets can catch sprites."
    ],
    "url": "https://oldschool.runescape.wiki/w/Fine_mesh_net"
}