{
    "id": 1066,
    "name": "Green d'hide vamb",
    "members": false,
    "tradeable": false,
    "stackable": true,
    "noted": true,
    "noteable": true,
    "equipable": false,
    "cost": 2500,
    "lowalch": 1000,
    "highalch": 1500,
    "weight": 0.25,
    "buy_limit": null,
    "quest_item": null,
    "release_date": "01 December 2003",
    "examine": [
        "Vambraces made from 100% real dragonhide."
    ],
    "url": "http://oldschoolrunescape.wikia.com/wiki/Green_d%27hide_vamb"
}