{
  "id": 11497,
  "name": "Super def. mix(2)",
  "tradeable": true,
  "stackable": false,
  "noteable": true,
  "equipable": false,
  "members": true,
  "weight": 0.0,
  "buy_limit": -1,
  "quest_item": true,
  "release_date": "03 July 2007",
  "cost": 198,
  "lowalch": 79,
  "highalch": 118,
  "examine": "X dose(s) of fishy super Defence potion.",
  "url": "http://2007.runescape.wikia.com/wiki/Super_def._mix"
}